### ISSUE TITLE
How to set up a permanent WarHawk server on WarHawk Reborn?

### ISSUE THREAD

**Issue by davidsummers** [warhawkreborn/connector_unix#3]
I've looked through all the code and web site and documentation and I may have missed something, but I'm not seeing how to set up a permanent server on WarHawk Reborn.

Does it have to be published in your list of servers at your web site to make it viewable from other clients or can someone set up their own server in some fashion and have other clients see that server?

I have two PS3s, one I have running a "permanent" (24x7x365) WarHawk server and one I use as a client to play games from.

How do I make my WarkHawk Server (SMETFO) viewable to other clients else where on the WarHawk Reborn system?

**Comment by davidsummers** [comment]
OK, never mind.  I see where you answered this question in issue #2.

Currently the Unix version doesn't have that capability.

**Comment by davidsummers** [comment]
I'm going to see if I can add this functionality by seeing how the Android version does it.

**Comment by Thalhammer** [comment]
Basically all you need to do is call a webapi which checks if the port forwarding is correctly set up.
And once it returns true you need to do a post to add a new server.

The important stuff is in the API class and the model subdirectory.

**Comment by Thalhammer** [comment]
I am going to add you to the organisation so you can commit to this repo right away, but make sure to create a feature branch and commit directly to master.

**Comment by davidsummers** [comment]
Thanks for the information, that will help a lot.

**Comment by davidsummers** [comment]
Status Update:

I've refactored the code to be able to have multiple "Servers" or "Tasks" running, not just the two that were there originally.  They all share the same udp_server which runs in background receiving packets and distributing the packets to the registered services/tasks.

The udp_server also now has the capability to ignore packets received that it sent out (based on the received IP address).

The "ServerSearchTask" is now broadcasting the DiscoveryPacket once every 30 seconds and I'm seeing that I'm getting a response back.

Now I just need to collect the responses, do the webapi port forwarding check, and then call the post host api to post the responses to the remote hosting server.

**Comment by davidsummers** [comment]
I'm now trying to send an AddHost JSON to the server as follows:

'''
{"fcm_id":"1234","hostname":"SMETFO","persistent":false}
'''

I'm getting back an HTTP 200 response but the data says:

'''
{"state":"failed"}
'''

Can I make up an fcm_id or how does that work?

Is there some other information that is needed to be sent in the AddHost post?

I was looking at the Android JAVA and all I could see in the AddHostRequest java class was:

hostname
fcm_id
persistent.

Can you tell me what I'm doing wrong?

Thanks!

**Comment by davidsummers** [comment]
Oh, wait, I just noticed you said above that the checkForwarding has to return "true" before you can post the AddHost????

I'll check for that while I'm waiting for your response.

**Comment by Thalhammer** [comment]
The problem you are facing is a feature thats there to prevent spaming, as well as some errors.
When you execute AddHost or checkForwarding the server will check if there is actually a Warhawk server running on your public IP.

That means before you can execute AddHost you need the following satified:
* PS3 Up and running
* Warhawk running and hosting a LAN Mode game
* Port 10029 UDP on your router forwarded to your PS3
* Public IPv4 of your Router reachable from the internet

You can check if the above are correct by using checkForwarding, which is essentially a stripped down version of addhost.

Regarding the parameters:
Hostname was intended to serv as a DynDNS hostname. This is only implemented for admin.
fcm_id is a firebase cloud messaging id to pass notifications to (If you use the android app you get a notification if your server no longer responds, e.g. because your PS3 crashed). If you don't need that feature you can pass null here (or leave it out entirely).
persistent was intended to allow servers which will stay in the list after the went offline. If you take a look at the server list response you will see some where "online" is false. Those are persistent servers. However this is also not implemented for anonymous users to prevent spam.

**Comment by davidsummers** [comment]
OK, I think I have met all those requirements.

I have my router set to forward external public IP to internal PS3 on UDP port 10029.

My PS3 is up and running, WARHAWK is hosting a LAN Mode game.

I verified with tcpdump that I can send external packets from another host on the internet to my  PS3 on port 10029.

However, I'm still getting "offline" state when I do the checkForward api packet.

Any ideas as to what I'm doing wrong?

**Comment by davidsummers** [comment]
I'm now seeing UDP 10029 packets incoming from 185.194.142.4 (mail.dothal.de).  I assume that is your API server?

But still checkForward returns "offline".

**Comment by Thalhammer** [comment]
Yes thats the API server. Make sure those reach the PS3 and there should be a reply of your PS3 to the packets.

**Comment by davidsummers** [comment]
10.0.7.112 is my WarHawk Reborn server.
10.0.7.51 is my PS3 server running WarHawk LAN SERVER mode hosting a game.

05:03:36.866368 IP 10.0.7.112.10029 > 255.255.255.255.10029: UDP, length 188
05:03:38.495137 IP 185.194.142.4.44051 > 10.0.7.51.10029: UDP, length 188
05:03:38.501047 IP 10.0.7.51.10029 > 185.194.142.4.44051: UDP, length 372
05:03:40.160008 IP 185.194.142.4.55654 > 10.0.7.51.10029: UDP, length 188
05:03:40.170134 IP 10.0.7.51.10029 > 185.194.142.4.55654: UDP, length 372

So it looks like my PS3 and your server are talking....but still "offline" mode response from checkForward.

**Comment by davidsummers** [comment]
Should I send a checkForward AND an AddHost, or should I wait to send an AddHost until AFTER I get an "online" status from checkForward?  If I'm doing the former would that mess it up?  (That's what I'm doing at the moment).

**Comment by davidsummers** [comment]
Output from my program:

SearchServer: Broadcasting - Searching for new servers to publish.
SearchServer: Collecting - Received packet.
ForwardServer: Received packet.
ForwardServer: Sending server list
SearchServer: Processing any collected packets.
SearchServer: Processing 1 packets.
SearchServer: State = 'offline', Public server IP = '24.248.212.140', Local  server IP = '10.0.7.51', Name = 'SMETFO', MapName = 'Island Outpost', GameMode = 'TDM'
SearchServer: Broadcasting - Searching for new servers to publish.
SearchServer: Collecting - Received packet.
ForwardServer: Received packet.
ForwardServer: Sending server list
SearchServer: Processing any collected packets.
SearchServer: Processing 1 packets.
SearchServer: State = 'offline', Public server IP = '24.248.212.140', Local  server IP = '10.0.7.51', Name = 'SMETFO', MapName = 'Island Outpost', GameMode = 'TDM'
MainLoop: Updating server list
MainLoop: 3 servers found
MainLoop: [┬▓]steedleyle0 156ms
MainLoop: FREE_BEER 194ms
MainLoop: MALO 127ms

**Comment by Thalhammer** [comment]
If you know for sure your forwarding is correct you should even be able to skip the check step entirely.

Can you try if it works using the android app ?

Traffic looks ok so thats probably not the problem.

I am not at a pc right now, so I can't really check whats wrong.

**Comment by davidsummers** [comment]
I don't have an Android.  Is there any other way?

**Comment by Thalhammer** [comment]
Not really at the moment. Can I message you back in an hour or so I can get to a PC ?

**Comment by davidsummers** [comment]
I've pushed my changes to https://github.com/davidsummers/connector_unix.git  on the hosting branch.

It compiles and runs under Linux, Mac, RaspberryPi, and Windows.

I'm currently testing with Windows running the WarHawk Reborn server.

**Comment by davidsummers** [comment]
Sure, no problem.   Thanks.

**Comment by Thalhammer** [comment]
Soooo did go faster than expected.
I ran a quick test and tried your server using my commandline utility (which is almost the some code the page uses) and it seems like there is never a response.

Somehow the UDP response seems to get lost. Do you have any sort of special router/firewall that might drop it ?

**Comment by davidsummers** [comment]
No, I am running my WarHawk in my public guest network which has no firewall between it and the Internet.

Only port forwarding.

According to the packets I'm seeing, our machines are talking back and forth:

05:38:06.193268 IP 84.162.157.130.13737 > 10.0.7.51.10029: UDP, length 188
05:38:06.225803 IP 10.0.7.51.10029 > 84.162.157.130.13737: UDP, length 372
05:38:07.365349 IP 84.162.157.130.6234 > 10.0.7.51.10029: UDP, length 188
05:38:07.391473 IP 10.0.7.51.10029 > 84.162.157.130.6234: UDP, length 372
05:38:08.500271 IP 84.162.157.130.12163 > 10.0.7.51.10029: UDP, length 188
05:38:08.527227 IP 10.0.7.51.10029 > 84.162.157.130.12163: UDP, length 372
05:38:09.669228 IP 84.162.157.130.21401 > 10.0.7.51.10029: UDP, length 188
05:38:09.695586 IP 10.0.7.51.10029 > 84.162.157.130.21401: UDP, length 372
05:38:10.801396 IP 84.162.157.130.58289 > 10.0.7.51.10029: UDP, length 188
05:38:10.829076 IP 10.0.7.51.10029 > 84.162.157.130.58289: UDP, length 372
05:38:11.968615 IP 84.162.157.130.63479 > 10.0.7.51.10029: UDP, length 188
05:38:11.998350 IP 10.0.7.51.10029 > 84.162.157.130.63479: UDP, length 372
05:38:13.108978 IP 84.162.157.130.15792 > 10.0.7.51.10029: UDP, length 188
05:38:13.133485 IP 10.0.7.51.10029 > 84.162.157.130.15792: UDP, length 372
05:38:14.275023 IP 84.162.157.130.9580 > 10.0.7.51.10029: UDP, length 188
05:38:14.298975 IP 10.0.7.51.10029 > 84.162.157.130.9580: UDP, length 372
05:38:15.432580 IP 84.162.157.130.39398 > 10.0.7.51.10029: UDP, length 188
05:38:15.467846 IP 10.0.7.51.10029 > 84.162.157.130.39398: UDP, length 372
05:38:16.580502 IP 84.162.157.130.40070 > 10.0.7.51.10029: UDP, length 188
05:38:16.601459 IP 10.0.7.51.10029 > 84.162.157.130.40070: UDP, length 372
05:38:17.731055 IP 84.162.157.130.65210 > 10.0.7.51.10029: UDP, length 188
05:38:17.736851 IP 10.0.7.51.10029 > 84.162.157.130.65210: UDP, length 372

**Comment by Thalhammer** [comment]
Do you have some messenger ?
Might be better fitted than this issue.

You can reach me on Discord
Thalhammer#2377

Facebook
https://www.facebook.com/thalhammer.d

Hm interesting. I ran wireshark on my notebook to check if I get any responses but there is nothing.
In fact I did not get a single packet in response.

**Comment by davidsummers** [comment]
Let me check my external interface for tcpdump.

**Comment by Thalhammer** [comment]
Not even a icmp error comming back. A normal ping however seems to work fine.
So I am pretty sure there is something wrong with your routing.

**Comment by davidsummers** [comment]
OK, I may know the problem.  I don't see the packets leaving my external interface.   I have a fairly big home office network and am using source address routing.   I'm betting my packets are going out another interface.   I'll see if I can source route the PS3 server to the same interface your packets are coming in.

It was just wierd because it *LOOKED* like it was talking back and forth and incoming is going to the right destination.

Give me a few minutes....

**Comment by davidsummers** [comment]
I'm starting to wonder if I've got a bug in my router software.

I have 8 public IP addresses and two routers and I'm doing policy based routing on the guest network.  It seems that some packets to your network go out one interface and some go out another interface.

What is the sequence of events on port 10029?

For the first thing that happens, does your server try to contact my PS3 or does my PS3 try to contact your server?

**Comment by Thalhammer** [comment]
Server sends a packet to your public port 10029, PS3 responds.
So you should see something like this:
mail.dothal.de => PS3 Port 10029 (size ~188 byte)
PS3 => mail.dothal.de (size ~300 + bytes)

One pair for each request you make to checkForward.

**Comment by davidsummers** [comment]
OK, I now see packets getting through and the status changed to "online".

Part of the problem is I have a really complicated network.

Part of the problem is that I was source routing packets from the guest network to another router.

The main problem was that I didn't think to pay attention to the ORDER of the port forwarding rules.

I had a global port forward to my main server taking precedence over a more specific rule to route the 10029 packets to the PS3.

Whew!

Wow!

What a pain a complicated network is!

:-)

I now am showing SMETFO in the networks you are publishing!

Thanks for your help and patience and nudge to check both my incoming and outgoing packets through all the interfaces.  I was assuming that because I saw some packets going back and forth between my system and yours that it was working.  But only SOME of the packets were being routed correctly.

OK.  I've got a couple of more cleanup items to do, but if this works (and it looks like it does) then my goal is accomplished for changing the program to be able to post servers to your service.

Very very neat!

**Comment by davidsummers** [comment]
Can you try connecting to the SMETFO server and make sure you can connect and play?

**Comment by Thalhammer** [comment]
I could if I had a PS3 with me but I don't :)
In case you are in the Newgeneration Warhawk Facebook group, just go there and make a post.
But if you got it to show up on the website I am pretty sure playing will work fine as well.

**Comment by davidsummers** [comment]
It's working! 

Someone just joined my server and killed me.

Good news!

:-)

**Comment by davidsummers** [comment]
Check out the code on my fork of your repo in my "hosting" branch.

**Comment by davidsummers** [comment]
I've got executables for all 4 platforms posted to:

https://summersoft.fay-ar.us/pub/games/warhawk subdirectories.
